{
  "$schema": "https://json-schema.org/draft/2020-12/schema",
  "title": "Render record, version 1",
  "description": "The result adapter-render writes for one rendering (docs/design/rendering.md), each value checked on its own: member sets, types, enumerations, ranges and lexical forms. It relates no value to another: that the size and the digest are those of the file the base64 holds, that the file is within the bound the record states, and that a Word file's parts are within it, are checked by render.Check (adapters/render). The schema is looser than the check in these places, and a record it admits may be one the check refuses: a title's length is counted here in characters and by the check in bytes of UTF-8; the pattern of provenance.observedAt admits a day the month does not have; and the canonical domain of SPEC.md section 1.1 is not known here, since a schema reads JSON that has been parsed, where a member named twice is one member and 7.0 is the integer 7; and an integer written with a sign, -0, is 0 here and is refused by the check, which reads an integer as digits. That the file is the archive the writer writes, laid out as docs/design/rendering.md says, is the check's as well. For a PDF the schema holds the record to naming a program with its digest and to saying what the program was handed; that the file begins and ends as a PDF does is the check's, and so is that the Word file the program was handed was within the bound. This is the producer's schema, closed as the adapter writes; a consumer validates for compatibility.",
  "type": "object",
  "additionalProperties": false,
  "required": [
    "renderVersion",
    "request",
    "file",
    "rendering",
    "provenance"
  ],
  "properties": {
    "renderVersion": {
      "const": "1"
    },
    "request": {
      "type": "object",
      "additionalProperties": false,
      "required": [
        "format",
        "title",
        "language",
        "contentDigest",
        "blocks",
        "textBytes",
        "cites"
      ],
      "properties": {
        "format": {
          "enum": [
            "docx",
            "pdf"
          ]
        },
        "title": {
          "type": "string",
          "minLength": 1,
          "maxLength": 255,
          "pattern": "^[^\\u0000-\\u001F\\u007F\ufffe\uffff]+(?![\\s\\S])"
        },
        "language": {
          "type": [
            "string",
            "null"
          ],
          "maxLength": 35,
          "pattern": "^[A-Za-z]{2,3}(?:-[A-Za-z0-9]{2,8})*(?![\\s\\S])"
        },
        "contentDigest": {
          "type": "string",
          "pattern": "^sha256:[0-9a-f]{64}(?![\\s\\S])"
        },
        "blocks": {
          "type": "integer",
          "minimum": 1,
          "maximum": 9007199254740991
        },
        "textBytes": {
          "type": "integer",
          "minimum": 0,
          "maximum": 9007199254740991
        },
        "cites": {
          "oneOf": [
            {
              "type": "null"
            },
            {
              "type": "object",
              "additionalProperties": false,
              "required": [
                "decision"
              ],
              "properties": {
                "decision": {
                  "type": "string",
                  "pattern": "^sha256:[0-9a-f]{64}(?![\\s\\S])"
                }
              }
            }
          ]
        }
      }
    },
    "file": {
      "type": "object",
      "additionalProperties": false,
      "required": [
        "mediaType",
        "size",
        "sha256",
        "encoding",
        "bytes"
      ],
      "properties": {
        "mediaType": {
          "enum": [
            "application/vnd.openxmlformats-officedocument.wordprocessingml.document",
            "application/pdf"
          ]
        },
        "size": {
          "type": "integer",
          "minimum": 1,
          "maximum": 9007199254740991
        },
        "sha256": {
          "type": "string",
          "pattern": "^sha256:[0-9a-f]{64}(?![\\s\\S])"
        },
        "encoding": {
          "const": "base64"
        },
        "bytes": {
          "type": "string",
          "minLength": 4,
          "pattern": "^(?:[A-Za-z0-9+/]{4})*(?:[A-Za-z0-9+/][AQgw]==|[A-Za-z0-9+/]{2}[AEIMQUYcgkosw048]=)?(?![\\s\\S])"
        }
      }
    },
    "rendering": {
      "type": "object",
      "additionalProperties": false,
      "required": [
        "status",
        "renderer",
        "bounds",
        "durationMs"
      ],
      "properties": {
        "status": {
          "const": "complete"
        },
        "renderer": {
          "oneOf": [
            {
              "type": "object",
              "additionalProperties": false,
              "required": [
                "kind",
                "name"
              ],
              "properties": {
                "kind": {
                  "const": "module"
                },
                "name": {
                  "const": "adapter-render/docx/1"
                }
              }
            },
            {
              "type": "object",
              "additionalProperties": false,
              "required": [
                "kind",
                "name",
                "digest"
              ],
              "properties": {
                "kind": {
                  "const": "program"
                },
                "name": {
                  "type": "string",
                  "minLength": 1,
                  "maxLength": 255,
                  "pattern": "^[^\\u0000-\\u0020\\u007F]+(?![\\s\\S])"
                },
                "digest": {
                  "type": "string",
                  "pattern": "^sha256:[0-9a-f]{64}(?![\\s\\S])"
                }
              }
            }
          ]
        },
        "bounds": {
          "type": "object",
          "additionalProperties": false,
          "required": [
            "maxRequestBytes",
            "maxBlocks",
            "maxFileBytes",
            "maxOutputBytes",
            "timeoutMs"
          ],
          "properties": {
            "maxRequestBytes": {
              "type": "integer",
              "minimum": 1,
              "maximum": 67108864
            },
            "maxBlocks": {
              "type": "integer",
              "minimum": 1,
              "maximum": 100000
            },
            "maxFileBytes": {
              "type": "integer",
              "minimum": 1,
              "maximum": 67108864
            },
            "maxOutputBytes": {
              "type": "integer",
              "minimum": 1,
              "maximum": 1099511627776
            },
            "timeoutMs": {
              "type": "integer",
              "minimum": 1,
              "maximum": 600000
            }
          }
        },
        "durationMs": {
          "type": "integer",
          "minimum": 0,
          "maximum": 9007199254740991
        },
        "source": {
          "type": "object",
          "additionalProperties": false,
          "required": [
            "mediaType",
            "size",
            "sha256",
            "renderer"
          ],
          "properties": {
            "mediaType": {
              "const": "application/vnd.openxmlformats-officedocument.wordprocessingml.document"
            },
            "size": {
              "type": "integer",
              "minimum": 1,
              "maximum": 9007199254740991
            },
            "sha256": {
              "type": "string",
              "pattern": "^sha256:[0-9a-f]{64}(?![\\s\\S])"
            },
            "renderer": {
              "type": "object",
              "additionalProperties": false,
              "required": [
                "kind",
                "name"
              ],
              "properties": {
                "kind": {
                  "const": "module"
                },
                "name": {
                  "const": "adapter-render/docx/1"
                }
              }
            }
          }
        }
      }
    },
    "provenance": {
      "type": "object",
      "additionalProperties": false,
      "required": [
        "adapter",
        "observedAt"
      ],
      "properties": {
        "adapter": {
          "type": "object",
          "additionalProperties": false,
          "required": [
            "name",
            "version",
            "digest"
          ],
          "properties": {
            "name": {
              "const": "adapter-render"
            },
            "version": {
              "type": "string",
              "minLength": 1
            },
            "digest": {
              "type": "string",
              "pattern": "^sha256:[0-9a-f]{64}(?![\\s\\S])"
            }
          }
        },
        "observedAt": {
          "type": "string",
          "pattern": "^[0-9]{4}-(?:0[1-9]|1[0-2])-(?:0[1-9]|[12][0-9]|3[01])T(?:[01][0-9]|2[0-3]):[0-5][0-9]:[0-5][0-9]Z(?![\\s\\S])"
        }
      }
    }
  },
  "allOf": [
    {
      "if": {
        "properties": {
          "request": {
            "properties": {
              "format": {
                "const": "pdf"
              }
            }
          }
        }
      },
      "then": {
        "properties": {
          "file": {
            "properties": {
              "mediaType": {
                "const": "application/pdf"
              }
            }
          },
          "rendering": {
            "required": [
              "source"
            ],
            "properties": {
              "renderer": {
                "type": "object",
                "additionalProperties": false,
                "required": [
                  "kind",
                  "name",
                  "digest"
                ],
                "properties": {
                  "kind": {
                    "const": "program"
                  },
                  "name": {
                    "type": "string",
                    "minLength": 1,
                    "maxLength": 255,
                    "pattern": "^[^\\u0000-\\u0020\\u007F]+(?![\\s\\S])"
                  },
                  "digest": {
                    "type": "string",
                    "pattern": "^sha256:[0-9a-f]{64}(?![\\s\\S])"
                  }
                }
              }
            }
          }
        }
      },
      "else": {
        "properties": {
          "file": {
            "properties": {
              "mediaType": {
                "const": "application/vnd.openxmlformats-officedocument.wordprocessingml.document"
              }
            }
          },
          "rendering": {
            "not": {
              "required": [
                "source"
              ]
            },
            "properties": {
              "renderer": {
                "type": "object",
                "additionalProperties": false,
                "required": [
                  "kind",
                  "name"
                ],
                "properties": {
                  "kind": {
                    "const": "module"
                  },
                  "name": {
                    "const": "adapter-render/docx/1"
                  }
                }
              }
            }
          }
        }
      }
    }
  ]
}
