{"file":{"bytes":"JVBERi0xLjQKMSAwIG9iago8PCAvVHlwZSAvQ2F0YWxvZyAvUGFnZXMgMiAwIFIgPj4KZW5kb2JqCjIgMCBvYmoKPDwgL1R5cGUgL1BhZ2VzIC9LaWRzIFszIDAgUl0gL0NvdW50IDEgPj4KZW5kb2JqCjMgMCBvYmoKPDwgL1R5cGUgL1BhZ2UgL1BhcmVudCAyIDAgUiAvTWVkaWFCb3ggWzAgMCA2MTIgNzkyXSAvQ29udGVudHMgNCAwIFIgL1Jlc291cmNlcyA8PCAvRm9udCA8PCAvRjEgNSAwIFIgPj4gPj4gPj4KZW5kb2JqCjQgMCBvYmoKPDwgL0xlbmd0aCAxODkgPj4Kc3RyZWFtCkJUIC9GMSAxNCBUZiA3MiA3MjAgVGQgMTggVEwgKFJlZnVuZCBkZWNpc2lvbikgVGogVCogKFRoZSByZWZ1bmQgb2YgMTQ5LjUwIENBRCBpcyBhcHByb3ZlZCB1bmRlciB0aGUgcmVmdW5kIHBvbGljeS4pIFRqIFQqIChcKEEgc3RhbmQtaW4gZm9yIGEgcmVuZGVyaW5nIHByb2dyYW0gd3JvdGUgdGhpcyBmaWxlLlwpKSBUaiBUKiBFVAplbmRzdHJlYW0KZW5kb2JqCjUgMCBvYmoKPDwgL1R5cGUgL0ZvbnQgL1N1YnR5cGUgL1R5cGUxIC9CYXNlRm9udCAvSGVsdmV0aWNhIC9FbmNvZGluZyAvV2luQW5zaUVuY29kaW5nID4+CmVuZG9iagp4cmVmCjAgNgowMDAwMDAwMDAwIDY1NTM1IGYgCjAwMDAwMDAwMDkgMDAwMDAgbiAKMDAwMDAwMDA1OCAwMDAwMCBuIAowMDAwMDAwMTE1IDAwMDAwIG4gCjAwMDAwMDAyNDEgMDAwMDAgbiAKMDAwMDAwMDQ4MSAwMDAwMCBuIAp0cmFpbGVyCjw8IC9TaXplIDYgL1Jvb3QgMSAwIFIgPj4Kc3RhcnR4cmVmCjU3OAolJUVPRgo=","encoding":"base64","mediaType":"application/pdf","sha256":"sha256:ff361fab308c64be2c79a91434e5de0895d51325225f01e5241cda77aeff76c2","size":761},"provenance":{"adapter":{"digest":"sha256:30b67e936187dd82dc567292ebe731fa3c0b665784094202b3e5f0589097e235","name":"adapter-render","version":"0"},"observedAt":"2026-09-28T22:12:38Z"},"renderVersion":"1","rendering":{"bounds":{"maxBlocks":2000,"maxFileBytes":4194304,"maxOutputBytes":1048576,"maxRequestBytes":1048576,"timeoutMs":25000},"durationMs":8,"renderer":{"digest":"sha256:a85b4c2602988f42dd7eba1a9426810576398d63995a02fe329d67e442af5d73","kind":"program","name":"standin-renderer"},"source":{"mediaType":"application/vnd.openxmlformats-officedocument.wordprocessingml.document","renderer":{"kind":"module","name":"adapter-render/docx/1"},"sha256":"sha256:3da82b3be616168c1353495579b7f91a16c6370d62896549833ed0d733bec49e","size":3551},"status":"complete"},"request":{"blocks":7,"cites":{"decision":"sha256:4f0c1d6a7b8e9f00112233445566778899aabbccddeeff00112233445566778a"},"contentDigest":"sha256:7a8867f6e9155668c1bd34bc033928afca8dc7ba4a4250004509ff7a1086d86e","format":"pdf","language":"en","textBytes":267,"title":"Refund decision"}}