{"file":{"bytes":"UEsDBBQAAAAIAAAAIQC5w9/vJQEAACQDAAATAAAAW0NvbnRlbnRfVHlwZXNdLnhtbKySz04CQQzG7z7FZq5kd9CDMYaFg3+OygEfYJztLhNn2klbcHl7s4CYGISYcG6/7/dr0smsT7FYA0sgrM11NTYFoKcmYFebt8VzeWcKUYeNi4RQmw2ImU2vJotNBin6FFFqs1TN99aKX0JyUlEG7FNsiZNTqYg7m53/cB3Ym/H41npCBdRShw4znTxC61ZRi6deAXciDFFM8bBbHFi1cTnH4J0GQrvG5hel3BMqhrjdkWXIMupTNPYoYZj8DdjnXtfAHBoo5o71xSWojf0kbmxDfpUAtTpdc8ST2jZ4OOSHtszkQSRgl2J1mCQXcHTOQ3QTQS5vses9i8dVegcO2F3e4FB9SqIhP2fKYj0x/N/h+2eGdJmZMrCGn7Pt9smnXwEAAP//UEsDBBQAAAAIAAAAIQB8jJ632gAAALsBAAALAAAAX3JlbHMvLnJlbHOMkMFKMzEQgO//U4S5d7Pt4Uek2V5E6E1kfYAhmd0NJpkwE3X79oIoWqnQ6/DxzTezP6w5mVcSjVwcbLseDBXPIZbZwdN4v7kBow1LwMSFHJxI4TD82z9Swha56BKrmjWnog6W1uqtteoXyqgdVyprThNLxqYdy2wr+mecye76/r+Vnw4YzpzmGBzIMWzBjKdK17h5mqKnO/YvmUq7sOIXAWZEmak5eGMJNnyOuzUnsJdrdtfX/H2pzdQwYEPrWWhThStJi6TfQYH9g3DVD+IryJ79fHgPAAD//1BLAwQUAAAACAAAACEAC1QWrscAAAAfAQAAEQAAAGRvY1Byb3BzL2NvcmUueG1sZM/BSu0wEMbx/X2Kkv3ptHchUtKcnWsRfYBhMicnmExCMpX69lKVblwO3/CDv73uOQ0f3Hosspp5nMzAQsVHCat5e326PJqhK4rHVIRX88ndXN0/S3Wh0vi5lcpNI/dhz0n6QnU1d9W6AHS6c8Y+lsqy53QrLaP2sbQAFekdA8P/aXqAzIoeFeEAL/UUzS/p6STr1tI34Ak4cWbRDvM4g3HW06JRE7sXvm3iB88UjyoL53L8JJSwYWDHP8t5W/jT5L4CAAD//1BLAwQUAAAACAAAACEA9CHHBuECAAAVDAAAEQAAAHdvcmQvZG9jdW1lbnQueG1s3FbNbhs3EL73KQjeu7uyraJdaOUaMtwaKAq3deEztRxpiXDJxZCr1d4iI4cYSI5GjrnnkgcIkDyMACOPEeyvLFuSZSS2kVxIe8T5+M3Hj9zp7U9jSSaARmgV0I7jUQIq1FyocUD/Pz36+VdKjGWKM6kVBDQHQ/f7P/Uyn+swjUFZMo2lMn4W0MjaxHddE0YQM+PoBNQ0liONMbPG0Th2M408QR2CMUKNY+nueN4vbsyEojUMbgOjRyMRwmFNoAJBkMwKrUwkEkP7vcwfap4Xc1IOJ1hO/9lcAsn8CZMB/RNYUWiHuv2e264ph7Is3yQshIAmCAZwArT/L4xSxQmHUBSKFVm2zMUKod1vE8hpBAQrID0iSxjNUDEZuuU4MBW/OroGtbP3m9P1yODgcBXimiQiDGFJgnoCnKSKA97kE+UJoBTqGUFf8IDiMd+lJPMjYazGPKAdepM2LovcANBtqrALbRItRZjflLjlc1dpzvrD2WSGnfuYgRmtzD33+UsYe8KQjZElES1PWKVxtVLIiWzWee1vx7yJNU6tE7ajWdhNY3G0GTMEwaaogJNM2EgosusRznLjfA9VsFinyhaeraxamEWKWNg77hEeaWUNyXxmQiECOtApCkDyN2SllQ+UuR0NzXJoG/d2Pc/xvHvcv4c36UGp2WqT2qGsp7qqoVza7ZQNJfyBgleHaIfyjGTFS9/1PK/QyOZJsVloaz7XkYq84s8xCj7Qskrc63q1I1aG3aVMW0FhC1lUD1iva8JhNTb/nV1DbBnyKWvg64XJV721xxbiFYq6CzpPQKo66fW03IWi34Tjxk/kY6jzaNe6+rQ+ubJHAD+UrLfeylWiuu0zdYuoKG+H2O52XF1czmcvrl5+mM/ezGfvry4+fX73ej67nJ+/ms8+lsG38+fnq97uIbobgP9JwZSNp79F67T3gK1T1TaZ32HK4kSCE+p4Q/PUal21ye6ioe9/CQAA//9QSwMEFAAAAAgAAAAhAGJaIb4JAQAA+gIAABwAAAB3b3JkL19yZWxzL2RvY3VtZW50LnhtbC5yZWxztNLPSgMxEMfxu08R5u6mrSJSmtaDCj14kfoAMTu7G5rMhExWdt9eROkfaMVDPSaH7+9DyGI1xKA+MItnMjCtJqCQHNeeWgNvm+fre1BSLNU2MKGBEQVWy6vFKwZbPJN0PokaYiAx0JWS5lqL6zBaqTghDTE0nKMtUnFudbJua1vUs8nkTufDBiyPmmpdG8jregpqMyb8S5ubxjt8ZNdHpHJiQksZAwqojc0tFgPf52qIAfTp+dkl56mP75g9tXvB7uo3xM0lEd2YMAdP2z3iKytzrXGwMQWsHEedOHjnUXTGpqd692gvXKOBp6FgJntWfPvP4mh9KDz/sT0cwM879dGXXX4GAAD//1BLAwQUAAAACAAAACEA/pJnyskCAACKDgAADwAAAHdvcmQvc3R5bGVzLnhtbMyWX2/aMBDA3/cpLL+vhgBRhwjVxtS1UtdVW7d3JznAqmNntmmgn36ynYR/CW1ppfEE9//u5wPd6GKZcfQISjMpItw962AEIpEpE7MI/76//HiOkTZUpJRLARFegcYX4w+jYqjNioNGy4wLPSwiPDcmHxKikzlkVJ/JHMQy41OpMmr0mVQzUkiV5komoDUTs4yToNMJSUaZwONRMUxl8hWmdMGNtqK6U6VYSvZDP6Fi+Eh5hIMAE6+Z6F0dp2JW6UBgVAyBavNZM1rJMUuZ+07GI1JmJ7s1813J1ctpwlx6OjWgItwNOzYjZxZPMPhUCT8XHCJMF0aWRfKyyGZasje2w4qKoVnlEOGcKjpTNJ/brKl3i3DXSs7xOo3wrUXMHUJBM6gGL9UOyN9L9wy+Dxf4TKk6+RVQuwvdvfRzb0BdXyGmGtIfoqm4gKU53FQN9wEgv4Wl161JxzCVytLtO9Ql+POOzyMXxvK+eeRVlc4m8Xp3Yt/oRJPtTeo1bJLXbWzGMdCCVmjBCULrvgpaEDb8/MJ3gNZrhdY7QWjB66D1G6D13wFavxVa/wSh9V4HrfWP/o3QBq3QBicIrX8a0MJWaOEJQhv8Z2g3TJu72rJLzlrR2vwcvgZMe8dIWKJIpDCwNAvKf3mX7ROkZYhkThVNDKgD10Z5q9RtX0ph9iYrndbDIedGXlx8vXarHBRn4mGvxtrSBK6xTbKxBInkUtUHwyDsTcpLZlEp7ZHK4WXPb2jM4QC1e2s/eKgh5+JbMDH3TZqYX4sUFfa+dhvvq6VLWjtOgPPv1HvLvN2Vw9R4a7dz3mCPpTEya49XbDY/kIBsN0PqIV7AbJvSN8XSPUbOgpyp6bU38e4R/CJVCkqvCW2+ri3/ZP9dkf81QTm9W4/1+V7zOyq2ZntUdEX+qGAmNEvh6m3hf44LJ9v4m3ai+qbH/wIAAP//UEsDBBQAAAAIAAAAIQCOKzZ1QgEAACIDAAASAAAAd29yZC9udW1iZXJpbmcueG1svJJBTvMwEIX3/yksS/+SOClSQVbT7iqBELAoB3CTaWppPI5sJ053nIWjcRKU0IYUVWIFK2vefG+i95TFqjPIWnBeW8p5lqScARW21FTl/GWzvrrlzAdFpUJLkPMDeL5a/ltESY3ZgtNUsc4geRlzvg+hlkL4Yg9G+cTWQJ3BnXVGBZ9YV4loXVk7W4D3miqDYpamc2GUJr5cRKm2PjhVhMfGsLPprsx5OiCmwaAfoAXcHGpgUbYKc95fQxhkLnoMW2RRamzxZPRBuXDis0+KGrM2o7htECGM/g104+r99W3U74uTirA74vWz6x9NJYuyl3N+M0s5i3KvqBrKvJ6nPSuOsBhuDe8k548lZL9dQgmFNgovtvA/S/6sBRrS0zT1WRXfQmCLTy04p0u4FHmy+3KJM9swU/9xMfm5lx8BAAD//1BLAQIUABQAAAAIAAAAIQC5w9/vJQEAACQDAAATAAAAAAAAAAAAAAAAAAAAAABbQ29udGVudF9UeXBlc10ueG1sUEsBAhQAFAAAAAgAAAAhAHyMnrfaAAAAuwEAAAsAAAAAAAAAAAAAAAAAVgEAAF9yZWxzLy5yZWxzUEsBAhQAFAAAAAgAAAAhAAtUFq7HAAAAHwEAABEAAAAAAAAAAAAAAAAAWQIAAGRvY1Byb3BzL2NvcmUueG1sUEsBAhQAFAAAAAgAAAAhAPQhxwbhAgAAFQwAABEAAAAAAAAAAAAAAAAATwMAAHdvcmQvZG9jdW1lbnQueG1sUEsBAhQAFAAAAAgAAAAhAGJaIb4JAQAA+gIAABwAAAAAAAAAAAAAAAAAXwYAAHdvcmQvX3JlbHMvZG9jdW1lbnQueG1sLnJlbHNQSwECFAAUAAAACAAAACEA/pJnyskCAACKDgAADwAAAAAAAAAAAAAAAACiBwAAd29yZC9zdHlsZXMueG1sUEsBAhQAFAAAAAgAAAAhAI4rNnVCAQAAIgMAABIAAAAAAAAAAAAAAAAAmAoAAHdvcmQvbnVtYmVyaW5nLnhtbFBLBQYAAAAABwAHAL8BAAAKDAAAAAA=","encoding":"base64","mediaType":"application/vnd.openxmlformats-officedocument.wordprocessingml.document","sha256":"sha256:3da82b3be616168c1353495579b7f91a16c6370d62896549833ed0d733bec49e","size":3551},"provenance":{"adapter":{"digest":"sha256:6575af8d85e15d1f89b7abaf92d7c9885b4e2e796ae99a1d21febf6ce445f7ba","name":"adapter-render","version":"0"},"observedAt":"2026-09-28T22:09:02Z"},"renderVersion":"1","rendering":{"bounds":{"maxBlocks":2000,"maxFileBytes":4194304,"maxOutputBytes":1048576,"maxRequestBytes":1048576,"timeoutMs":25000},"durationMs":11,"renderer":{"kind":"module","name":"adapter-render/docx/1"},"status":"complete"},"request":{"blocks":7,"cites":{"decision":"sha256:4f0c1d6a7b8e9f00112233445566778899aabbccddeeff00112233445566778a"},"contentDigest":"sha256:7a8867f6e9155668c1bd34bc033928afca8dc7ba4a4250004509ff7a1086d86e","format":"docx","language":"en","textBytes":267,"title":"Refund decision"}}